{
  "id": "TKT-090",
  "epic_id": "EPIC-011",
  "title": "Novel Composite Metrics",
  "description": "Create novel composite metrics combining multiple factors",
  "state": "DONE",
  "priority": "P2",
  "progress_pct": 100,
  "owner": "Stephen Curry",
  "gates": {},
  "created_at": "2026-02-05T00:00:00Z",
  "updated_at": "2026-02-13T14:00:00.000000Z"
}
