{
  "id": "TKT-081",
  "epic_id": "EPIC-008",
  "title": "Define expected schemas per output",
  "description": "Create schema contracts for all outputs",
  "state": "BACKLOG",
  "priority": "P1",
  "progress_pct": 0,
  "owner": "N'Golo Kant√©",
  "sprint_id": "SPRINT-001",
  "gates": {},
  "created_at": "2026-02-04T00:00:00Z",
  "updated_at": "2026-02-05T00:00:00Z"
}
