{
  "id": "TKT-017",
  "epic_id": "EPIC-003",
  "title": "Create HOW_IT_WORKS.md",
  "description": "Create docs/HOW_IT_WORKS.md explaining system operation",
  "state": "DONE",
  "priority": "P1",
  "progress_pct": 100,
  "owner": "Tom Brady",
  "assignee": "Brad Stevens",
  "sprint_id": "SPRINT-001",
  "gates": {
    "florentino_gate": {"status": "APPROVED", "date": "2026-02-01"},
    "founder_validation": {"status": "APPROVED", "validated_by": "Founder", "date": "2026-02-01"}
  },
  "created_at": "2026-02-01T00:00:00Z",
  "updated_at": "2026-02-01T00:00:00Z",
  "completed_at": "2026-02-01T00:00:00Z"
}
