{
  "id": "TKT-053",
  "epic_id": "EPIC-006",
  "title": "Add editorial narrative",
  "description": "Improve prose quality across stat packs",
  "state": "DONE",
  "priority": "P1",
  "progress_pct": 100,
  "owner": "Virat Kohli",
  "sprint_id": "SPRINT-001",
  "gates": {},
  "created_at": "2026-02-04T00:00:00Z",
  "updated_at": "2026-02-05T00:00:00Z"
}
