{
  "id": "TKT-178",
  "title": "Research Desk — Design & Visual Integration",
  "state": "DONE",
  "priority": "P0",
  "progress_pct": 100,
  "description": "Match The Lab's dark theme using existing CSS variables and card-based layout. Responsive design (mobile-friendly — at minimum schema browser + example queries work on small screens). Add 'Research Desk' tab to The Lab navigation. Consistent loading states and animations. Brand consistency with existing sports analytics aesthetic. No clipart. This ticket runs in parallel with all others and provides the visual foundation.",
  "epic_id": "EPIC-012",
  "owner": "Kevin De Bruyne",
  "assignee": "Kevin De Bruyne",
  "sprint_id": "SPRINT-001",
  "gates": {
    "florentino_gate": {
      "status": "APPROVED",
      "reason": "Film Room shipped and live — retroactive approval",
      "approved_by": "Florentino Perez",
      "date": "2026-02-10"
    },
    "domain_sanity": {
      "andy_flower": "YES",
      "date": "2026-02-10"
    },
    "system_check": {
      "status": "PASS",
      "tests_passed": 265,
      "tests_total": 265,
      "checked_by": "N'Golo Kante",
      "date": "2026-02-10"
    },
    "founder_validation": {
      "status": "APPROVED",
      "feedback": "Film Room shipped and verified live",
      "validated_by": "Founder",
      "date": "2026-02-10"
    }
  },
  "created_at": "2026-02-10T04:26:00.322821Z",
  "updated_at": "2026-02-10T10:35:01.199674Z",
  "completed_at": "2026-02-10T10:35:01.198097Z"
}
