{
  "id": "TKT-169",
  "title": "Fix N'Golo Kanté name inconsistency in Mission Control",
  "state": "DONE",
  "priority": "P2",
  "progress_pct": 100,
  "epic_id": "EPIC-003",
  "assignee": "Tom Brady",
  "sprint_id": "SPRINT-001",
  "gates": {
    "florentino_gate": {
      "status": "APPROVED",
      "reason": "Data integrity issue in our own QA system. Must fix.",
      "approved_by": "Florentino Perez",
      "date": "2026-02-09"
    },
    "domain_sanity": {
      "jose_mourinho": "YES",
      "date": "2026-02-09",
      "andy_flower": "YES",
      "pep_guardiola": "YES"
    },
    "enforcement_check": {
      "status": "PASS",
      "issues": [],
      "checked_by": "Tom Brady",
      "date": "2026-02-09"
    },
    "system_check": {
      "status": "PASS",
      "tests_passed": 253,
      "tests_total": 253,
      "checked_by": "N'Golo Kanté",
      "date": "2026-02-09"
    },
    "founder_validation": {
      "status": "APPROVED",
      "feedback": "Founder approved — deliverable verified",
      "validated_by": "Founder",
      "date": "2026-02-09"
    }
  },
  "created_at": "2026-02-09T17:31:10.253786Z",
  "updated_at": "2026-02-09T17:52:27.133122Z",
  "completed_at": "2026-02-09T17:52:27.128272Z"
}
