{
  "id": "TKT-084",
  "epic_id": "EPIC-009",
  "title": "Add script header comments",
  "description": "Update scripts with proper header comments",
  "state": "DONE",
  "priority": "P2",
  "progress_pct": 100,
  "owner": "Stephen Curry",
  "sprint_id": "SPRINT-001",
  "gates": {},
  "created_at": "2026-02-05T00:00:00Z",
  "updated_at": "2026-02-05T00:00:00Z"
}
