{
  "id": "TKT-179",
  "title": "Document Film Room NL Search Patterns & Example Prompts",
  "state": "DONE",
  "priority": "P1",
  "progress_pct": 100,
  "description": "Create a reference document listing all supported natural language search patterns in The Film Room, with example prompts and their expected SQL/output. This helps users understand what queries work and guides future pattern development. Include: (1) All 11 current patterns with 2-3 example prompts each, (2) Expected output description for each, (3) Tips for phrasing queries, (4) Known limitations. Location: docs/film_room_search_guide.md",
  "epic_id": "EPIC-012",
  "assignee": "Founder",
  "sprint_id": "SPRINT-001",
  "gates": {
    "florentino_gate": {
      "status": "APPROVED",
      "reason": "Low-cost documentation task, directly improves Film Room usability",
      "approved_by": "Florentino Perez",
      "date": "2026-02-10"
    },
    "domain_sanity": {
      "andy_flower": "YES",
      "date": "2026-02-12",
      "jose_mourinho": "YES",
      "pep_guardiola": "YES"
    },
    "enforcement_check": {
      "status": "PASS",
      "issues": [],
      "checked_by": "Tom Brady",
      "date": "2026-02-12"
    },
    "system_check": {
      "status": "PASS",
      "tests_passed": 253,
      "tests_total": 253,
      "checked_by": "Kante",
      "date": "2026-02-12"
    },
    "founder_validation": {
      "status": "APPROVED",
      "feedback": "NL search patterns documented in TKT-181 NL Search Strategy plan (932 lines). All 12 intent types, 76 view mappings, and example queries covered.",
      "validated_by": "Founder",
      "date": "2026-02-12"
    }
  },
  "created_at": "2026-02-10T06:36:26.931104Z",
  "updated_at": "2026-02-12T01:57:54.384210Z",
  "completed_at": "2026-02-12T01:57:54.382439Z"
}
