{
  "id": "TKT-010",
  "epic_id": "EPIC-002",
  "title": "Define Jose Mourinho review criteria",
  "description": "Embed criteria in TASK_INTEGRITY_LOOP.md",
  "state": "DONE",
  "priority": "P0",
  "progress_pct": 100,
  "owner": "Jose Mourinho",
  "assignee": "Tom Brady",
  "sprint_id": "SPRINT-001",
  "gates": {
    "florentino_gate": {"status": "APPROVED", "date": "2026-02-01"},
    "founder_validation": {"status": "APPROVED", "validated_by": "Founder", "date": "2026-02-01"}
  },
  "created_at": "2026-02-01T00:00:00Z",
  "updated_at": "2026-02-01T00:00:00Z",
  "completed_at": "2026-02-01T00:00:00Z"
}
