{
  "id": "TKT-166",
  "title": "Expand Brock Purdy mandate — data monitoring and alerting automation",
  "state": "DONE",
  "priority": "P2",
  "progress_pct": 100,
  "epic_id": "EPIC-004",
  "assignee": "Brock Purdy",
  "sprint_id": "SPRINT-001",
  "gates": {
    "florentino_gate": {
      "status": "APPROVED",
      "reason": "Data monitoring prevents silent data quality degradation. Operational necessity.",
      "approved_by": "Florentino Perez",
      "date": "2026-02-09"
    },
    "domain_sanity": {
      "jose_mourinho": "YES",
      "date": "2026-02-09",
      "andy_flower": "YES",
      "pep_guardiola": "YES"
    },
    "enforcement_check": {
      "status": "PASS",
      "issues": [],
      "checked_by": "Tom Brady",
      "date": "2026-02-09"
    },
    "system_check": {
      "status": "PASS",
      "tests_passed": 253,
      "tests_total": 253,
      "checked_by": "N'Golo Kanté",
      "date": "2026-02-09"
    },
    "founder_validation": {
      "status": "APPROVED",
      "feedback": "Founder approved — deliverable verified",
      "validated_by": "Founder",
      "date": "2026-02-09"
    }
  },
  "created_at": "2026-02-09T17:31:06.836193Z",
  "updated_at": "2026-02-09T17:52:26.784784Z",
  "completed_at": "2026-02-09T17:52:26.778068Z"
}
