{
  "id": "TKT-163",
  "title": "Retrain LeBron James as Reader Perspective Auditor",
  "state": "DONE",
  "priority": "P1",
  "progress_pct": 100,
  "epic_id": "EPIC-006",
  "assignee": "LeBron James",
  "sprint_id": "SPRINT-001",
  "gates": {
    "florentino_gate": {
      "status": "APPROVED",
      "reason": "Reader perspective testing improves product quality at zero extra cost.",
      "approved_by": "Florentino Perez",
      "date": "2026-02-09"
    },
    "domain_sanity": {
      "jose_mourinho": "YES",
      "date": "2026-02-09",
      "andy_flower": "YES",
      "pep_guardiola": "YES"
    },
    "enforcement_check": {
      "status": "PASS",
      "issues": [],
      "checked_by": "Tom Brady",
      "date": "2026-02-09"
    },
    "system_check": {
      "status": "PASS",
      "tests_passed": 253,
      "tests_total": 253,
      "checked_by": "N'Golo Kanté",
      "date": "2026-02-09"
    },
    "founder_validation": {
      "status": "APPROVED",
      "feedback": "Founder approved — deliverable verified",
      "validated_by": "Founder",
      "date": "2026-02-09"
    }
  },
  "created_at": "2026-02-09T17:31:03.807615Z",
  "updated_at": "2026-02-09T17:52:26.671581Z",
  "completed_at": "2026-02-09T17:52:26.666041Z"
}
