{
  "id": "TKT-075",
  "epic_id": "EPIC-007",
  "title": "Create .github/workflows/README.md",
  "description": "Document GitHub Actions workflows",
  "state": "DONE",
  "priority": "P2",
  "progress_pct": 100,
  "owner": "Brad Stevens",
  "sprint_id": "SPRINT-001",
  "gates": {},
  "created_at": "2026-02-05T00:00:00Z",
  "updated_at": "2026-02-05T00:00:00Z"
}
